{
  "$schema": "https://json-schema.org/draft/2020-12/schema",
  "$id": "https://github.com/lucashgrifoni/OSS-Security-Policy-as-Code-Starter-Kit/reports/schema/evidence-github-rulesets.schema.json",
  "title": "GitHub rulesets evidence",
  "type": "object",
  "required": ["schema_version", "attested_at", "attested_by", "repository", "posture"],
  "additionalProperties": false,
  "properties": {
    "schema_version": { "type": "string", "const": "github-rulesets/v1" },
    "attested_at": { "type": "string", "format": "date" },
    "attested_by": { "type": "string" },
    "repository": { "type": "string" },
    "posture": {
      "type": "object",
      "required": [
        "require_pull_request",
        "require_status_checks",
        "restrict_force_push",
        "require_code_owner_review"
      ],
      "additionalProperties": false,
      "properties": {
        "require_pull_request": { "type": "boolean" },
        "require_status_checks": { "type": "boolean" },
        "restrict_force_push": { "type": "boolean" },
        "require_code_owner_review": { "type": "boolean" }
      }
    },
    "collection": {
      "type": "object",
      "additionalProperties": false,
      "required": ["evidence_collection_method", "collected_at", "source_url"],
      "properties": {
        "evidence_collection_method": { "type": "string", "enum": ["live", "manual"] },
        "collected_at": { "type": "string" },
        "source_url": { "type": "string" },
        "mode": { "type": "string", "enum": ["api"] }
      }
    },
    "notes": { "type": "string" }
  }
}
